{
  "$schema": "https://json-schema.org/draft/2020-12/schema",
  "title": "Execution Spec v2.0",
  "description": "Structural schema for the canonical Execution Spec artifact.",
  "type": "object",
  "additionalProperties": false,
  "properties": {
    "schema_version": {},
    "feature_slug": {
      "$ref": "#/$defs/feature_slug"
    },
    "repo_target": {
      "$ref": "#/$defs/repository_key"
    },
    "branch": {
      "$ref": "#/$defs/machine_string"
    },
    "base_commit": {
      "$ref": "#/$defs/commit_sha"
    },
    "goal": {
      "$ref": "#/$defs/single_line_prose"
    },
    "context": {
      "$ref": "#/$defs/multiline_prose"
    },
    "scope": {
      "$ref": "#/$defs/scope"
    },
    "steps": {
      "title": "Steps",
      "description": "Ordered executable steps.",
      "type": "array",
      "minItems": 1,
      "items": {
        "$ref": "#/$defs/step"
      }
    },
    "validation": {
      "$ref": "#/$defs/validation"
    },
    "completion_criteria": {
      "$ref": "#/$defs/criteria_array"
    }
  },
  "required": [
    "feature_slug",
    "repo_target",
    "branch",
    "base_commit",
    "goal",
    "context",
    "scope",
    "steps",
    "validation",
    "completion_criteria"
  ],
  "$defs": {
    "feature_slug": {
      "title": "Feature slug",
      "description": "Lowercase kebab-case feature slug.",
      "type": "string",
      "pattern": "^(?!.*[\\r\\n])[a-z0-9]+(?:-[a-z0-9]+)*$"
    },
    "single_line_prose": {
      "title": "Single-line prose",
      "description": "Nonblank human prose without line breaks.",
      "type": "string",
      "pattern": "^(?!.*[\\r\\n])(?!\\s*$)[^\\r\\n]*\\S[^\\r\\n]*$"
    },
    "multiline_prose": {
      "title": "Markdown-capable prose",
      "description": "Nonblank prose that may contain Markdown and line breaks.",
      "type": "string",
      "pattern": "^[\\s\\S]*\\S[\\s\\S]*$"
    },
    "machine_string": {
      "title": "Machine string",
      "description": "Nonblank single-line value without outer whitespace or control characters.",
      "type": "string",
      "pattern": "^(?!.*[\\r\\n])(?!\\s*$)(?!\\s)(?!.*\\s$)[^\\u0000-\\u001F\\u007F]+$"
    },
    "repository_key": {
      "title": "Repository key",
      "description": "Nonblank local repository binding or key.",
      "$ref": "#/$defs/machine_string"
    },
    "commit_sha": {
      "title": "Commit SHA",
      "description": "Lowercase full 40-character Git commit SHA.",
      "type": "string",
      "pattern": "^(?!.*[\\r\\n])[0-9a-f]{40}$"
    },
    "path": {
      "title": "Repository-relative path",
      "description": "Basic POSIX-style repository-relative path.",
      "type": "string",
      "pattern": "^(?!.*[\\r\\n])(?!/)(?![A-Za-z]:)(?!//)(?!.*\\\\)(?!.*(?:^|/)\\.\\.?$)(?!.*(?:^|/)\\.\\.?/)(?!\\s)(?!.*\\s$)(?!.*[\\u0000-\\u001F\\u007F]).*\\S.*$"
    },
    "scope": {
      "title": "Scope",
      "description": "In-scope and out-of-scope implementation boundaries.",
      "type": "object",
      "additionalProperties": false,
      "properties": {
        "in_scope": {
          "$ref": "#/$defs/criteria_array"
        },
        "out_of_scope": {
          "$ref": "#/$defs/criteria_array"
        }
      },
      "required": [
        "in_scope",
        "out_of_scope"
      ]
    },
    "criteria_array": {
      "title": "Criteria array",
      "description": "Nonempty list of single-line nonblank prose items.",
      "type": "array",
      "minItems": 1,
      "items": {
        "$ref": "#/$defs/single_line_prose"
      }
    },
    "substep_reference": {
      "title": "Substep reference",
      "description": "Positive step and substep coordinates in <step>.<substep> form.",
      "type": "string",
      "pattern": "^[1-9][0-9]*\\.[1-9][0-9]*$"
    },
    "step": {
      "title": "Step",
      "description": "One numbered executable step.",
      "type": "object",
      "additionalProperties": false,
      "properties": {
        "number": {
          "type": "integer",
          "minimum": 1
        },
        "goal": {
          "$ref": "#/$defs/single_line_prose"
        },
        "substeps": {
          "type": "array",
          "minItems": 1,
          "items": {
            "$ref": "#/$defs/substep"
          }
        },
        "completion_criteria": {
          "$ref": "#/$defs/criteria_array"
        }
      },
      "required": [
        "number",
        "goal",
        "substeps",
        "completion_criteria"
      ]
    },
    "substep": {
      "title": "Substep",
      "description": "One numbered executable substep.",
      "type": "object",
      "additionalProperties": false,
      "properties": {
        "number": {
          "type": "integer",
          "minimum": 1
        },
        "instruction": {
          "$ref": "#/$defs/single_line_prose"
        },
        "depends_on": {
          "type": "array",
          "minItems": 1,
          "uniqueItems": true,
          "items": {
            "$ref": "#/$defs/substep_reference"
          }
        },
        "atomic": {
          "type": "boolean"
        },
        "files": {
          "type": "array",
          "minItems": 1,
          "items": {
            "$ref": "#/$defs/file"
          }
        },
        "completion_criteria": {
          "$ref": "#/$defs/criteria_array"
        }
      },
      "required": [
        "number",
        "instruction",
        "files",
        "completion_criteria"
      ]
    },
    "file": {
      "title": "File declaration",
      "description": "A declared file operation for a substep.",
      "oneOf": [
        {
          "$ref": "#/$defs/modify_file"
        },
        {
          "$ref": "#/$defs/create_file"
        },
        {
          "$ref": "#/$defs/delete_file"
        },
        {
          "$ref": "#/$defs/rename_file"
        }
      ]
    },
    "modify_file": {
      "title": "Modify file declaration",
      "type": "object",
      "additionalProperties": false,
      "properties": {
        "path": {
          "$ref": "#/$defs/path"
        },
        "operation": {
          "const": "modify"
        },
        "purpose": {
          "$ref": "#/$defs/single_line_prose"
        },
        "implementation": {
          "$ref": "#/$defs/modify_implementation"
        }
      },
      "required": [
        "path",
        "operation",
        "purpose",
        "implementation"
      ]
    },
    "create_file": {
      "title": "Create file declaration",
      "type": "object",
      "additionalProperties": false,
      "properties": {
        "path": {
          "$ref": "#/$defs/path"
        },
        "operation": {
          "const": "create"
        },
        "purpose": {
          "$ref": "#/$defs/single_line_prose"
        },
        "implementation": {
          "$ref": "#/$defs/create_implementation"
        }
      },
      "required": [
        "path",
        "operation",
        "purpose",
        "implementation"
      ]
    },
    "delete_file": {
      "title": "Delete file declaration",
      "type": "object",
      "additionalProperties": false,
      "properties": {
        "path": {
          "$ref": "#/$defs/path"
        },
        "operation": {
          "const": "delete"
        },
        "purpose": {
          "$ref": "#/$defs/single_line_prose"
        },
        "implementation": {
          "$ref": "#/$defs/delete_implementation"
        }
      },
      "required": [
        "path",
        "operation",
        "purpose",
        "implementation"
      ]
    },
    "rename_file": {
      "title": "Rename file declaration",
      "type": "object",
      "additionalProperties": false,
      "properties": {
        "path": {
          "$ref": "#/$defs/path"
        },
        "destination_path": {
          "$ref": "#/$defs/path"
        },
        "operation": {
          "const": "rename"
        },
        "purpose": {
          "$ref": "#/$defs/single_line_prose"
        },
        "implementation": {
          "$ref": "#/$defs/rename_implementation"
        }
      },
      "required": [
        "path",
        "destination_path",
        "operation",
        "purpose",
        "implementation"
      ]
    },
    "modify_implementation": {
      "title": "Modify implementation",
      "type": "object",
      "additionalProperties": false,
      "properties": {
        "changes": {
          "type": "array",
          "minItems": 1,
          "items": {
            "$ref": "#/$defs/modify_change"
          }
        }
      },
      "required": [
        "changes"
      ]
    },
    "modify_change": {
      "title": "Modify change directive",
      "oneOf": [
        {
          "$ref": "#/$defs/replace_change"
        },
        {
          "$ref": "#/$defs/insert_before_change"
        },
        {
          "$ref": "#/$defs/insert_after_change"
        },
        {
          "$ref": "#/$defs/remove_change"
        },
        {
          "$ref": "#/$defs/replace_file_change"
        }
      ]
    },
    "replace_change": {
      "type": "object",
      "additionalProperties": false,
      "properties": {
        "kind": {
          "const": "replace"
        },
        "old_text": {
          "$ref": "#/$defs/multiline_prose"
        },
        "new_text": {
          "$ref": "#/$defs/multiline_prose"
        },
        "expected_occurrences": {
          "$ref": "#/$defs/expected_occurrences"
        }
      },
      "required": [
        "kind",
        "old_text",
        "new_text",
        "expected_occurrences"
      ]
    },
    "insert_before_change": {
      "type": "object",
      "additionalProperties": false,
      "properties": {
        "kind": {
          "const": "insert_before"
        },
        "anchor": {
          "$ref": "#/$defs/multiline_prose"
        },
        "content": {
          "$ref": "#/$defs/multiline_prose"
        },
        "expected_occurrences": {
          "$ref": "#/$defs/expected_occurrences"
        }
      },
      "required": [
        "kind",
        "anchor",
        "content",
        "expected_occurrences"
      ]
    },
    "insert_after_change": {
      "type": "object",
      "additionalProperties": false,
      "properties": {
        "kind": {
          "const": "insert_after"
        },
        "anchor": {
          "$ref": "#/$defs/multiline_prose"
        },
        "content": {
          "$ref": "#/$defs/multiline_prose"
        },
        "expected_occurrences": {
          "$ref": "#/$defs/expected_occurrences"
        }
      },
      "required": [
        "kind",
        "anchor",
        "content",
        "expected_occurrences"
      ]
    },
    "remove_change": {
      "type": "object",
      "additionalProperties": false,
      "properties": {
        "kind": {
          "const": "remove"
        },
        "old_text": {
          "$ref": "#/$defs/multiline_prose"
        },
        "expected_occurrences": {
          "$ref": "#/$defs/expected_occurrences"
        }
      },
      "required": [
        "kind",
        "old_text",
        "expected_occurrences"
      ]
    },
    "replace_file_change": {
      "type": "object",
      "additionalProperties": false,
      "properties": {
        "kind": {
          "const": "replace_file"
        },
        "content": {
          "$ref": "#/$defs/multiline_prose"
        }
      },
      "required": [
        "kind",
        "content"
      ]
    },
    "expected_occurrences": {
      "type": "integer",
      "minimum": 1
    },
    "create_implementation": {
      "title": "Create implementation",
      "type": "object",
      "additionalProperties": false,
      "properties": {
        "content": {
          "$ref": "#/$defs/multiline_prose"
        }
      },
      "required": [
        "content"
      ]
    },
    "delete_implementation": {
      "title": "Delete implementation",
      "type": "object",
      "additionalProperties": false,
      "properties": {
        "delete_file": {
          "const": true
        }
      },
      "required": [
        "delete_file"
      ]
    },
    "rename_implementation": {
      "title": "Rename implementation",
      "type": "object",
      "additionalProperties": false,
      "properties": {
        "preserve_content": {
          "const": true
        },
        "content": {
          "$ref": "#/$defs/multiline_prose"
        }
      },
      "oneOf": [
        {
          "required": [
            "preserve_content"
          ],
          "not": {
            "required": [
              "content"
            ]
          }
        },
        {
          "required": [
            "content"
          ],
          "not": {
            "required": [
              "preserve_content"
            ]
          }
        }
      ]
    },
    "validation": {
      "title": "Validation",
      "description": "Focused validation commands and optional Executor checks.",
      "type": "object",
      "additionalProperties": false,
      "properties": {
        "commands": {
          "type": "array",
          "minItems": 1,
          "items": {
            "$ref": "#/$defs/validation_command"
          }
        },
        "executor_checks": {
          "type": "array",
          "minItems": 1,
          "items": {
            "$ref": "#/$defs/single_line_prose"
          }
        }
      },
      "required": [
        "commands"
      ]
    },
    "validation_command": {
      "title": "Validation command",
      "description": "One focused validation command.",
      "type": "object",
      "additionalProperties": false,
      "properties": {
        "command": {
          "$ref": "#/$defs/single_line_prose"
        },
        "working_directory": {
          "$ref": "#/$defs/path"
        },
        "expected": {
          "$ref": "#/$defs/single_line_prose"
        }
      },
      "required": [
        "command",
        "expected"
      ]
    }
  }
}
